{
  "_spdx": "GPL-3.0-only",
  "schema": 2,
  "status": "reviewed-generated-source",
  "reason": "",
  "component": {
    "component_id": "mesa-23-1-9-generated",
    "upstream_name": "mesa9x",
    "repository": "https://github.com/JHRobotics/mesa9x.git",
    "owning_commit": "29b9adb44bc5ea54dc53c02b5e4b49292c6cc04f",
    "mesa_version": "23.1.9",
    "mesa_subtree": "mesa-23.1.x"
  },
  "provenance": {
    "generated_source_plan": {
      "relative_path": "mesa-generated-source-plan.json",
      "bytes": 4354,
      "sha256": "7d08ea089889105443935fb48a59a69698e5c0cac9f5f87ff02c8710c2a5718c"
    },
    "generated_source_reproducibility": {
      "relative_path": "mesa-generated-source-reproducibility.json",
      "bytes": 4418,
      "sha256": "d37322e969730fb71d2663c19752728802631cb9bd55b3d294824e3ac4ca2f0b"
    },
    "component_closure": {
      "relative_path": "component-closures/mesa9x-23.1.x.json",
      "bytes": 815285,
      "sha256": "d93a476656ec9f18c1d257a65ae6461111c7e85ec0b704360bcc42b836dbefc5"
    },
    "generator_recipe": {
      "relative_path": "generator/mesa-23.1.x-gen.mk",
      "git_blob": "68b2fd13d08ae0ce4276cb1f720ee9bbb1cd54e9",
      "bytes": 13288,
      "sha256": "9ad77b1fe55e4097621dbefeffe989fb00f3c354320ce6521d69f8efd8a44dce"
    },
    "source_seed": {
      "relative_path": "mesa-source-seed.json",
      "bytes": 6915,
      "sha256": "b7a18f8bfe4bfe5fac1ef8b4f36105d585e7d69349766d865c8c79a180d79dd8"
    },
    "recipe_variable": "GENERATE_FILES",
    "recipe_output_sequence_sha256": "480f4000b3d6c10eced24e4538ee4aabdd59e3dbe3172054910bc7eac01c7140"
  },
  "license_evidence": [
    {
      "id": "01-mit-output-06",
      "origin": "generated-output",
      "subject": {
        "relative_path": "mesa-23.1.x/src/compiler/glsl/glcpp/glcpp-lex.c",
        "bytes": 91086,
        "sha256": "cfeafa42c7910a2c4c4a8a5bf277561f46c53e700a470956e7a33b041875febd"
      },
      "evidence_file": {
        "relative_path": "mesa-23.1.x/src/compiler/glsl/glcpp/glcpp-lex.c",
        "bytes": 91086,
        "sha256": "cfeafa42c7910a2c4c4a8a5bf277561f46c53e700a470956e7a33b041875febd"
      },
      "locator": {
        "kind": "byte-range",
        "byte_offset": 28923,
        "byte_count": 1155,
        "sha256": "59b5406d7a1d9e6c834d8dc3709af7ca2bb09a08fe8c8855693d26d6410e48e9"
      },
      "license_expression": "MIT"
    },
    {
      "id": "01-mit-output-07",
      "origin": "generated-output",
      "subject": {
        "relative_path": "mesa-23.1.x/src/compiler/glsl/glcpp/glcpp-parse.c",
        "bytes": 170644,
        "sha256": "8b2f1679bed27ec00bf8fe6ea551baf80127deab65c0772ba31bd73b0290cc63"
      },
      "evidence_file": {
        "relative_path": "mesa-23.1.x/src/compiler/glsl/glcpp/glcpp-parse.c",
        "bytes": 170644,
        "sha256": "8b2f1679bed27ec00bf8fe6ea551baf80127deab65c0772ba31bd73b0290cc63"
      },
      "locator": {
        "kind": "byte-range",
        "byte_offset": 2857,
        "byte_count": 1155,
        "sha256": "59b5406d7a1d9e6c834d8dc3709af7ca2bb09a08fe8c8855693d26d6410e48e9"
      },
      "license_expression": "MIT"
    },
    {
      "id": "01-mit-output-08",
      "origin": "generated-output",
      "subject": {
        "relative_path": "mesa-23.1.x/src/compiler/glsl/glsl_lexer.cpp",
        "bytes": 158552,
        "sha256": "7b5e02ef7339fce6148f4819ff96c21364943127958e861a7d6bb3354a0f47e7"
      },
      "evidence_file": {
        "relative_path": "mesa-23.1.x/src/compiler/glsl/glsl_lexer.cpp",
        "bytes": 158552,
        "sha256": "7b5e02ef7339fce6148f4819ff96c21364943127958e861a7d6bb3354a0f47e7"
      },
      "locator": {
        "kind": "byte-range",
        "byte_offset": 62227,
        "byte_count": 1161,
        "sha256": "e75948fa374d2c4072db360a44e8b1b861f4bb6f9d062d4fa3a3cf96af80fe32"
      },
      "license_expression": "MIT"
    },
    {
      "id": "01-mit-output-09",
      "origin": "generated-output",
      "subject": {
        "relative_path": "mesa-23.1.x/src/compiler/glsl/glsl_parser.cpp",
        "bytes": 264511,
        "sha256": "114e83e5f704e4c1bd2523abe3f43db25891e930e1b228373b727cb119b23eed"
      },
      "evidence_file": {
        "relative_path": "mesa-23.1.x/src/compiler/glsl/glsl_parser.cpp",
        "bytes": 264511,
        "sha256": "114e83e5f704e4c1bd2523abe3f43db25891e930e1b228373b727cb119b23eed"
      },
      "locator": {
        "kind": "byte-range",
        "byte_offset": 2848,
        "byte_count": 1161,
        "sha256": "e75948fa374d2c4072db360a44e8b1b861f4bb6f9d062d4fa3a3cf96af80fe32"
      },
      "license_expression": "MIT"
    },
    {
      "id": "01-mit-output-11",
      "origin": "generated-output",
      "subject": {
        "relative_path": "mesa-23.1.x/src/compiler/glsl/ir_expression_operation_strings.h",
        "bytes": 5850,
        "sha256": "67bed528eb9f90510366a78c0373aa0248221c9e936c29b7b836ef378641e9ed"
      },
      "evidence_file": {
        "relative_path": "mesa-23.1.x/src/compiler/glsl/ir_expression_operation_strings.h",
        "bytes": 5850,
        "sha256": "67bed528eb9f90510366a78c0373aa0248221c9e936c29b7b836ef378641e9ed"
      },
      "locator": {
        "kind": "byte-range",
        "byte_offset": 0,
        "byte_count": 1156,
        "sha256": "3a487a74732a8365953cb33a428aada713dc52ad61a66c5d71b11036bbb89b15"
      },
      "license_expression": "MIT"
    },
    {
      "id": "01-mit-output-12",
      "origin": "generated-output",
      "subject": {
        "relative_path": "mesa-23.1.x/src/compiler/ir_expression_operation.h",
        "bytes": 4797,
        "sha256": "a523f6b315fe5229028efb9ec012ff282061801c806b60c482d6aa3cdf7320c7"
      },
      "evidence_file": {
        "relative_path": "mesa-23.1.x/src/compiler/ir_expression_operation.h",
        "bytes": 4797,
        "sha256": "a523f6b315fe5229028efb9ec012ff282061801c806b60c482d6aa3cdf7320c7"
      },
      "locator": {
        "kind": "byte-range",
        "byte_offset": 0,
        "byte_count": 1156,
        "sha256": "3a487a74732a8365953cb33a428aada713dc52ad61a66c5d71b11036bbb89b15"
      },
      "license_expression": "MIT"
    },
    {
      "id": "01-mit-output-13",
      "origin": "generated-output",
      "subject": {
        "relative_path": "mesa-23.1.x/src/compiler/nir/nir_builder_opcodes.h",
        "bytes": 746665,
        "sha256": "3d893f463a4561ec542a35c1835fb5393b84f5e17acdda64357bd352b7751588"
      },
      "evidence_file": {
        "relative_path": "mesa-23.1.x/src/compiler/nir/nir_builder_opcodes.h",
        "bytes": 746665,
        "sha256": "3d893f463a4561ec542a35c1835fb5393b84f5e17acdda64357bd352b7751588"
      },
      "locator": {
        "kind": "byte-range",
        "byte_offset": 0,
        "byte_count": 1144,
        "sha256": "b1cf1997dd06a00a9468c75c78b5ff02d87aa5a43e706e37ab01f1bdd7b84fe7"
      },
      "license_expression": "MIT"
    },
    {
      "id": "01-mit-output-14",
      "origin": "generated-output",
      "subject": {
        "relative_path": "mesa-23.1.x/src/compiler/nir/nir_constant_expressions.c",
        "bytes": 1173720,
        "sha256": "53687f6baa538dabfd8b0bb637862b3fd716eb67fef3857ae984448f30cb1c96"
      },
      "evidence_file": {
        "relative_path": "mesa-23.1.x/src/compiler/nir/nir_constant_expressions.c",
        "bytes": 1173720,
        "sha256": "53687f6baa538dabfd8b0bb637862b3fd716eb67fef3857ae984448f30cb1c96"
      },
      "locator": {
        "kind": "byte-range",
        "byte_offset": 0,
        "byte_count": 1156,
        "sha256": "e9ec55f6b1c489a4821a8599dfe0b6dcd54c608bf339142d03e5cc548f2b89ce"
      },
      "license_expression": "MIT"
    },
    {
      "id": "01-mit-output-15",
      "origin": "generated-output",
      "subject": {
        "relative_path": "mesa-23.1.x/src/compiler/nir/nir_intrinsics.c",
        "bytes": 233196,
        "sha256": "66bd2db561d6f1f9d6a27a41e2bfc92baab7b8b9118726d5344e6bab7f814d58"
      },
      "evidence_file": {
        "relative_path": "mesa-23.1.x/src/compiler/nir/nir_intrinsics.c",
        "bytes": 233196,
        "sha256": "66bd2db561d6f1f9d6a27a41e2bfc92baab7b8b9118726d5344e6bab7f814d58"
      },
      "locator": {
        "kind": "byte-range",
        "byte_offset": 0,
        "byte_count": 1143,
        "sha256": "31279e12ebd426fb9c4a8e379e7d5d7a718c95276d1698b0f43f5abaeb1d1cc8"
      },
      "license_expression": "MIT"
    },
    {
      "id": "01-mit-output-16",
      "origin": "generated-output",
      "subject": {
        "relative_path": "mesa-23.1.x/src/compiler/nir/nir_intrinsics.h",
        "bytes": 29614,
        "sha256": "e89e368e7940be36550f6c5787923ebe1715f164702d159a38d3e33059a6d4ba"
      },
      "evidence_file": {
        "relative_path": "mesa-23.1.x/src/compiler/nir/nir_intrinsics.h",
        "bytes": 29614,
        "sha256": "e89e368e7940be36550f6c5787923ebe1715f164702d159a38d3e33059a6d4ba"
      },
      "locator": {
        "kind": "byte-range",
        "byte_offset": 0,
        "byte_count": 1143,
        "sha256": "31279e12ebd426fb9c4a8e379e7d5d7a718c95276d1698b0f43f5abaeb1d1cc8"
      },
      "license_expression": "MIT"
    },
    {
      "id": "01-mit-output-17",
      "origin": "generated-output",
      "subject": {
        "relative_path": "mesa-23.1.x/src/compiler/nir/nir_intrinsics_indices.h",
        "bytes": 41371,
        "sha256": "58d95cb56b2e2d71326c5e9098c1b35c9e3dfe63bd678c257cd3ec0facfc559c"
      },
      "evidence_file": {
        "relative_path": "mesa-23.1.x/src/compiler/nir/nir_intrinsics_indices.h",
        "bytes": 41371,
        "sha256": "58d95cb56b2e2d71326c5e9098c1b35c9e3dfe63bd678c257cd3ec0facfc559c"
      },
      "locator": {
        "kind": "byte-range",
        "byte_offset": 0,
        "byte_count": 1183,
        "sha256": "2786e44ae999a0aa33bec846ce270b4ce888a0290639a8818f95d0e9505107c8"
      },
      "license_expression": "MIT"
    },
    {
      "id": "01-mit-output-19",
      "origin": "generated-output",